{
  "$schema": "urn:fortress:schema:v1:certification-result",
  "schema_version": 1,
  "profile": {
    "id": "CERT-FULL-SNAPSHOT-V1",
    "version": 1
  },
  "subject": "sha256:41a8bbc4b6169fdb133b39c9da09e869cccc91b16c04912d472f72a2697c6eb1",
  "status": "PASS",
  "certification_digest": "sha256:cee527dea9c1e65114368055166bdca6dbcf2122a61aa45ff5cd51584bd06629",
  "evidence_graph_digest": "sha256:60c2591a8d9743d974d9b51dfa77f8e39735505aa9489f9871ea99bc5ff41eb2",
  "obligations": [
    {
      "kind": "STANDARD_RULE",
      "subject": "ARCH-DEPENDENCY-001",
      "required_evidence_classes": [
        "STATIC_PROOF"
      ],
      "evidence_refs": [
        "sha256:75843edd0f0b7179ff0bb385b929af6366638fec8d29c45d76a92ff7a0aa424c"
      ],
      "status": "PASS",
      "reason": "applicable rule has current PASS proof"
    },
    {
      "kind": "STANDARD_RULE",
      "subject": "ARCH-OWNERSHIP-001",
      "required_evidence_classes": [
        "STATIC_PROOF"
      ],
      "evidence_refs": [
        "sha256:8e8cabdf42a4908a49663de5b0907da5656765131a53835d86944559b2452845"
      ],
      "status": "PASS",
      "reason": "applicable rule has current PASS proof"
    },
    {
      "kind": "STANDARD_RULE",
      "subject": "ARCH-REALIZATION-001",
      "required_evidence_classes": [
        "STATIC_PROOF"
      ],
      "evidence_refs": [
        "sha256:0b907dca3b3a898b3e5623e0f976fb077db9eb7233467cf03334820360ddf987"
      ],
      "status": "PASS",
      "reason": "applicable rule has current PASS proof"
    },
    {
      "kind": "STANDARD_RULE",
      "subject": "BEHAVIOR-BYPASS-001",
      "required_evidence_classes": [
        "STATIC_PROOF"
      ],
      "evidence_refs": [
        "sha256:1eb2a4e41d5dea5e03bb23e239333a52abac4cd468e425ca7faff43fc12bdd2a"
      ],
      "status": "PASS",
      "reason": "applicable rule has current PASS proof"
    },
    {
      "kind": "STANDARD_RULE",
      "subject": "BEHAVIOR-FLOW-001",
      "required_evidence_classes": [
        "STATIC_PROOF"
      ],
      "evidence_refs": [
        "sha256:7f627c3bec1cae3452124ff4a4cfcffd70aaccc9d155747867d84f89ef8752ab"
      ],
      "status": "PASS",
      "reason": "applicable rule has current PASS proof"
    },
    {
      "kind": "STANDARD_RULE",
      "subject": "BEHAVIOR-REALIZATION-001",
      "required_evidence_classes": [
        "STATIC_PROOF"
      ],
      "evidence_refs": [
        "sha256:5b9423ae245957d760bf3f37ec5a1701105923ceb4de94fe27cd8ca6556882af"
      ],
      "status": "PASS",
      "reason": "applicable rule has current PASS proof"
    },
    {
      "kind": "STANDARD_RULE",
      "subject": "CONTRACT-COHERENCY-001",
      "required_evidence_classes": [
        "STATIC_PROOF"
      ],
      "evidence_refs": [
        "sha256:cb02f162b07c70b31090c3afd4ca98c0f5d93972e686432b29c1a2ecef30d988"
      ],
      "status": "PASS",
      "reason": "applicable rule has current PASS proof"
    },
    {
      "kind": "STANDARD_RULE",
      "subject": "PROGRAM-DOMAIN-001",
      "required_evidence_classes": [
        "STATIC_PROOF"
      ],
      "evidence_refs": [
        "sha256:062a66dd8530de8413f683a994b4592a498e4b19a891361369da2dec23f4b675"
      ],
      "status": "PASS",
      "reason": "applicable rule has current PASS proof"
    },
    {
      "kind": "STANDARD_RULE",
      "subject": "PROGRAM-EFFECT-001",
      "required_evidence_classes": [
        "STATIC_PROOF"
      ],
      "evidence_refs": [
        "sha256:39dce8fc65ed0c708782fec00fd3221a20500dbb79e59d2e81df6a6666e3f498"
      ],
      "status": "PASS",
      "reason": "applicable rule has current PASS proof"
    },
    {
      "kind": "STANDARD_RULE",
      "subject": "PROGRAM-ENVIRONMENT-001",
      "required_evidence_classes": [
        "STATIC_PROOF"
      ],
      "evidence_refs": [
        "sha256:cf096cfc1bcda90ddccbbeb4dc13ff0b35c788b5d21ff5393b0625a053b15da7"
      ],
      "status": "PASS",
      "reason": "applicable rule has current PASS proof"
    },
    {
      "kind": "STANDARD_RULE",
      "subject": "PROGRAM-INFOFLOW-001",
      "required_evidence_classes": [
        "STATIC_PROOF"
      ],
      "evidence_refs": [
        "sha256:35705f629c8fefde1cde1d00ab1d46639ddda5f097fe9742c0ae375d4ee6ed70"
      ],
      "status": "PASS",
      "reason": "applicable rule has current PASS proof"
    },
    {
      "kind": "STANDARD_RULE",
      "subject": "PROGRAM-RECOVERY-001",
      "required_evidence_classes": [
        "STATIC_PROOF"
      ],
      "evidence_refs": [
        "sha256:73157eb9e705a9624784f58e418e0c1724165aacd48806b23e56877c23c6708f"
      ],
      "status": "PASS",
      "reason": "applicable rule has current PASS proof"
    },
    {
      "kind": "STANDARD_RULE",
      "subject": "PROGRAM-RETRY-001",
      "required_evidence_classes": [
        "STATIC_PROOF"
      ],
      "evidence_refs": [
        "sha256:5290c3363224d262b0a6dedf32e209024043de0954a9d759d15aad8ac4a2c931"
      ],
      "status": "PASS",
      "reason": "applicable rule has current PASS proof"
    },
    {
      "kind": "STANDARD_RULE",
      "subject": "PROGRAM-STATE-001",
      "required_evidence_classes": [
        "STATIC_PROOF"
      ],
      "evidence_refs": [
        "sha256:c7ed3099e2dfd34efc5d7a6879ad46a9ac73679741ff8a71e9e1ad06e49489c0"
      ],
      "status": "PASS",
      "reason": "applicable rule has current PASS proof"
    },
    {
      "kind": "STANDARD_RULE",
      "subject": "REPO-DOCS-001",
      "required_evidence_classes": [
        "STATIC_PROOF"
      ],
      "evidence_refs": [
        "sha256:c90dd2153ffb880ee240eeb2d6b34c86c3aee9d01d2098e9c6871154ecf191e0"
      ],
      "status": "PASS",
      "reason": "applicable rule has current PASS proof"
    },
    {
      "kind": "STANDARD_RULE",
      "subject": "REPO-MODULE-001",
      "required_evidence_classes": [
        "STATIC_PROOF"
      ],
      "evidence_refs": [
        "sha256:680089076c34132c6737b2b647590f0bd0e326d3f375a97f8473376a56c52928"
      ],
      "status": "PASS",
      "reason": "applicable rule has current PASS proof"
    },
    {
      "kind": "STANDARD_RULE",
      "subject": "REPO-REFERENCE-001",
      "required_evidence_classes": [
        "STATIC_PROOF"
      ],
      "evidence_refs": [
        "sha256:c93ad86060ff76b022d169ef737f3175f6ed375a89599a444b73258449a1757d"
      ],
      "status": "PASS",
      "reason": "applicable rule has current PASS proof"
    },
    {
      "kind": "STANDARD_RULE",
      "subject": "SOURCE-ARTIFACT-001",
      "required_evidence_classes": [
        "STATIC_PROOF"
      ],
      "evidence_refs": [
        "sha256:cecc99efa22315423480c30447a2f0ef0496eaccbb4ce1a27d3d3835e2b6d785"
      ],
      "status": "PASS",
      "reason": "applicable rule has current PASS proof"
    },
    {
      "kind": "STANDARD_RULE",
      "subject": "SOURCE-PROFILE-001",
      "required_evidence_classes": [
        "STATIC_PROOF"
      ],
      "evidence_refs": [
        "sha256:d9a82fbba53a63af47dfb40fe4aea3cd3fb57d1c3a9e99d2deab1208aea3f0d7"
      ],
      "status": "PASS",
      "reason": "applicable rule has current PASS proof"
    },
    {
      "kind": "STANDARD_RULE",
      "subject": "STD-ID-001",
      "required_evidence_classes": [
        "STATIC_PROOF"
      ],
      "evidence_refs": [
        "sha256:c4a646582effbe763e709463c3d868626dc75963d2acb702afe3574399070dd2"
      ],
      "status": "PASS",
      "reason": "applicable rule has current PASS proof"
    },
    {
      "kind": "STANDARD_RULE",
      "subject": "TEST-BOUNDARY-001",
      "required_evidence_classes": [
        "STATIC_PROOF"
      ],
      "evidence_refs": [
        "sha256:b5ee1da04c87e43d9fdaac58e2cdaaa0915914508bae921b58cb540811ef4318"
      ],
      "status": "PASS",
      "reason": "applicable rule has current PASS proof"
    },
    {
      "kind": "STANDARD_RULE",
      "subject": "TEST-TRACEABILITY-001",
      "required_evidence_classes": [
        "STATIC_PROOF"
      ],
      "evidence_refs": [
        "sha256:d61ee3568e1e6090aa3907095aa802f61f1c49f33b9f72ac3425f1191dbe704a"
      ],
      "status": "PASS",
      "reason": "applicable rule has current PASS proof"
    },
    {
      "kind": "FEATURE_REQUIREMENT",
      "subject": "AF-AFFECTED-ANALYSIS-0001-R01",
      "required_evidence_classes": [
        "EXECUTED_TEST"
      ],
      "evidence_refs": [
        "sha256:ada397e4e33663eca03e7aa8d11a7089044afb043ec279cb2596fe3fcfe64c4e",
        "sha256:25e975a3a041edda74b6094620f1e9364a5cbba2887cbf6aa3ca8029727b73f2",
        "sha256:19c9e7458da187b3893d7f0ab725f34536152159953bb12a5bb30212b38473ce"
      ],
      "status": "PASS",
      "reason": "every declared required test is eligible and covered by the successful canonical suite"
    },
    {
      "kind": "FEATURE_REQUIREMENT",
      "subject": "AF-AFFECTED-ANALYSIS-0001-R02",
      "required_evidence_classes": [
        "EXECUTED_TEST"
      ],
      "evidence_refs": [
        "sha256:a3d0bb5dac9c6a905cd29fd58337939671e34b674b36398a2da072f8e42eacf3",
        "sha256:5e5bb7e9a2af1b9fe8924c542f3b4fda14e55833b70f07c246a58a0adc81f906",
        "sha256:302028787d6388ce00646e5aa1962c95774ca2e80ecdf89a697372f90f18c10e",
        "sha256:d03d70275364229da3f93e792274d4b9e96caaeee2e5853c40b2b20b59f4f723"
      ],
      "status": "PASS",
      "reason": "every declared required test is eligible and covered by the successful canonical suite"
    },
    {
      "kind": "FEATURE_REQUIREMENT",
      "subject": "AF-AFFECTED-ANALYSIS-0001-R03",
      "required_evidence_classes": [
        "EXECUTED_TEST"
      ],
      "evidence_refs": [
        "sha256:6967d763558716a52b20289f27914914983c723b6088193fbb31c9ff6b3e8ebd",
        "sha256:ede8988184fc06eb18dfe921b8ad55579326b7d906e9a4192d806e671d7c4486",
        "sha256:74e204246338cda5c0059522b0b911ca06af58917770f94832e1a2ca7667b2b7",
        "sha256:a30be30980107749a026b1c5ddd09f926c0d769162bac03567c88ab9d9c28bcf"
      ],
      "status": "PASS",